comment_id,comment_text,Sentiment,Name of media,link
221-1,"I can define the terms, but I'm not going to be in a position to debate them or anything,

The idea of a ""circular"" economy is a proposed alternative to the ""linear"" economy we use now.

The ""Linear"" economy pattern is basically a three step process:

Creation (Manufacturing gruop)

Sale/Use (Retailers/Consumers)

Disposal (End point)

It creates a straight line from manufacturing, retail, and then disposal when the object breaks or is obsolete. Most of the time it's how we function now.

A ""Circular"" economy puts a much greater focus on reuse, repair, and recycling objects to extract maximum value out of them for as long as is possible, creating a ""circular"" pattern of use:

Creation (Manufacture)

Sale/Use (Retail/Consumer)

Reuse/Repair (Repair)

Recycling (Extract all possible usable materials and use them for Creation of another item)

The idea here being that we can extract, reuse, and get absolute maximum return on an object or the materials used in its construction, as well as making use of every material possible.",positive,Reddit,https://www.reddit.com/r/OutOfTheLoop/comments/8x7exx/why_am_i_hearing_the_phrase_circular_economy/
222-1,"From the European commission have been a lot of movements to promote sustainable economies among member states... Its basically a sustainability push. Plenty of other countries and organizations are also going with this in the last years.

The WC has tons of resources and guides for circular economy you could check out on their site if you wanted more info.
The WC has tons of resources and guides for circular economy you could check out on their site if you wanted more info.",positive,Reddit,https://www.reddit.com/r/OutOfTheLoop/comments/8x7exx/why_am_i_hearing_the_phrase_circular_economy/
223-1,"This will not be a shock to anyone who has read the works of people like Derrick Jensen, but it’s obvious civilization is unsustainable.

Civilization is characterized by some by the growth of cities. Cities emerge when a group of people decide to stop moving from place to place to find better resources, and occupy a fixed part of land. They denude that area of a certain resource, and then keep denuding areas of land beyond the city until the resource is no longer economical to extract. This arrangement divorces people from their connection to the land, allowing them to be apathetic about what’s going on outside the city. This arrangement also would not have been possible without agriculture.",neutral,Reddit,https://www.reddit.com/r/collapse/comments/amqt90/civilization_is_inherently_unsustainable_a/
223-2,"There are some that think a circular economy fixes this - make our energy production and consumption 100% renewable, and we are fine. But all industrial products have a certain lifetime, and only a small amount of these products are recyclable. Plastic can be recycled about 7 times before it loses its original properties. Only a small percentage of the metals in electronics can be recycled. In short, industrial civilization cannot exist without waste, and the type and quantity of waste cannot be absorbed by the sinks in the environment at a fast enough rate.

The only sustainable level of technology is the Stone Age, and we are going to be there again someday, the only questions are: what’s going to be left of the world when we get there? Will humans even exist? When will this happen? How shall I live my life knowing this?

Think hard on these questions my friends, and do not feel guilty about enjoying the immense luxuries being alive at this point in history has afforded us.",negative,Reddit,https://www.reddit.com/r/collapse/comments/amqt90/civilization_is_inherently_unsustainable_a/
224-1,"A circular economy is possible, you just won't like it. All natural materials, nothing nonrenewable... pre-industrial basically.",negative,Reddit,https://www.reddit.com/r/collapse/comments/amqt90/civilization_is_inherently_unsustainable_a/
225-1,"People get ""100% renewable electricity"" and ""100% renewable energy"" switched up every time. There's no way airplanes, caterpillar ore trucks and bunker ships are moving with solar.

It's scary how many people think everyone is going to happily give up cheeseburgers, SUVs and their smartphones once we achieve luxury ubi socialjusticeism.",negative,Reddit,https://www.reddit.com/r/collapse/comments/amqt90/civilization_is_inherently_unsustainable_a/
226-1,You’d probably be interested in readings on anarcho primitivism or post-civ thinking...maybe ecological municipalism,neutral,Reddit,https://www.reddit.com/r/collapse/comments/amqt90/civilization_is_inherently_unsustainable_a/
227-1,"If the ecosystem increases in complexity without destroying itself, so could a civilization. Human beings are just too dumb.",negative,Reddit,https://www.reddit.com/r/collapse/comments/amqt90/civilization_is_inherently_unsustainable_a/
228-1,Ecology is evidence that fully circular material flows are possible in principle.,positive,Reddit,https://www.reddit.com/r/collapse/comments/amqt90/civilization_is_inherently_unsustainable_a/
229-1,"We will probably never be truly sustainable, that is true. There will always be some kind of a wall in the horizon. But all arguments against sustainability are arguments in the now, they're not definitive arguments. For example in just a couple of years we've gone from asking what on Earth could slow down the demand for oil into asking what could keep the demand growing.",negative,Reddit,https://www.reddit.com/r/collapse/comments/amqt90/civilization_is_inherently_unsustainable_a/
230-1,"Nothing is sustainable, even the universe itself isn't.",negative,Reddit,https://www.reddit.com/r/collapse/comments/amqt90/civilization_is_inherently_unsustainable_a/
231-1,"disagree. In terms of Derrick Jensen is like a tautology, but if for ""civilization"" you define some form of cultural mix between our present scientific knowledge and the ancient narrative of union with nature we can survive a transition for a search of sustainable future.",neutral,Reddit,https://www.reddit.com/r/collapse/comments/amqt90/civilization_is_inherently_unsustainable_a/
231-2,"We can make protein for human consumption without kill one animal more, but instead that process is used for feed fish!! Absurd. https://www.google.com/amp/s/www.cbc.ca/amp/1.3359601

We can live without internet or just internet for universities and only academic purpose, but here we are with an absurd usage of social medias. https://www.statista.com/chart/16478/domain-backlinks-website/",negative,Reddit,https://www.reddit.com/r/collapse/comments/amqt90/civilization_is_inherently_unsustainable_a/
231-3,"We can live with NEVER fly (imagine politics only by skype) the consumerist ideology of obtain more experiences is very toxic in many levels.

Fuck some modern medicine, fuck the search of immortality, the moral obligation of take care of sick elders, yes to euthanasia, yes to all kind of population control, fuck you if a bear catch you, you are not allowed to fight, you are not allowed to exist just because, and if you kill any animal you must die",negative,Reddit,https://www.reddit.com/r/collapse/comments/amqt90/civilization_is_inherently_unsustainable_a/
232-1,"We tried the stone age... it led to agriculture, slavery, Industrial Civilization, mass extinction and possibly human extinction. The stone age was not sustainable, it was just a very slow period. A truly sustainable form of human existence hasn’t been discovered yet.",negative,Reddit,https://www.reddit.com/r/collapse/comments/amqt90/civilization_is_inherently_unsustainable_a/
233-1,"I read 5 books from him

That aside that is why we are going to space",neutral,Reddit,https://www.reddit.com/r/collapse/comments/amqt90/civilization_is_inherently_unsustainable_a/
234-1,"Well some of the resources can be supplied from other planets. It is possible today. But not ""necessary"" yet.

Civilization is not sustainable if you think of the earth as an isolated system. It is not an isolated system.",neutral,Reddit,https://www.reddit.com/r/collapse/comments/amqt90/civilization_is_inherently_unsustainable_a/
235-1,"It cost $2.5B to land the Curiosity rover on Mars. A human mission to Mars is expected to cost about $500B. That's just to send people to visit and come back. And some think that's a vast underestimate.

Harvesting minerals from other planets is technically possible, but the amount of infrastructure required would be inordinately expensive, and honestly it would probably make more sense to find ways to mine our own trash for these minerals than get them from other planets.",neutral,Reddit,https://www.reddit.com/r/collapse/comments/amqt90/civilization_is_inherently_unsustainable_a/
236-1,"If implemented broadly and highly efficiently it could allow ""growth on a finite planet"", which is why I think it definitely deserves attention.

Often environmentalists call for a change of economic systems or a complete abandonment of capitalism, and I definitely have sympathy for that view, it just seems to be easier said than done. A perfectly circular economy would allow ""business as usual"" for the most part while not depleting resources or creating unsustainable amounts of waste. CE also doesn't seem to be technologically unfeasible (I'd love to hear and engineer's take). What it does require is a lot of political commitment to supporting/requiring reuse and recycling over extraction and production techniques which leave resources easily reusable.",positive,Reddit,https://www.reddit.com/r/sustainability/comments/4xrrs9/what_do_you_think_about_circular_economy/
236-2,"As far as I'm aware we don't really know what an economy that doesn't rely on growth would look like exactly, nor how such a steady state could be sustained. I realize work is being done on this, so if someone has good reading on this let me know. CE allows economic growth while not messing up the environments, which is why I see it as a solid alternative to a steady state economy. And who says the two have to be separate, CE wouldn't conflict with de-growth in any way.",neutral,Reddit,https://www.reddit.com/r/sustainability/comments/4xrrs9/what_do_you_think_about_circular_economy/
237-1,"Here's the European Commission strategy for a circular economy: http://ec.europa.eu/environment/circular-economy/index_en.htm

It's a start for sure. What it seems to lack is strong measures for requiring producers to produce products which are easily reusable. I mean does intend to create ""Economic incentives for producers to put greener products on the market and support recovery and recycling schemes."" which to me rings far weaker than necessary.

If we are going about this by economic incentives, by carrot rather than stick, then I'd like to see increased costs on products and processes which add new extracted components or alternatively tax breaks on products and processes which do not rely on further extraction. That would include imports to the European Economic Area and it would also consider the non-EEA sections of the production chain.",negative,Reddit,https://www.reddit.com/r/sustainability/comments/4xrrs9/what_do_you_think_about_circular_economy/
238-1,You may want to check out [r/circular_economy] (https://www.reddit.com/r/circular_economy/) for case studies and more info,neutral,Reddit,https://www.reddit.com/r/sustainability/comments/4xrrs9/what_do_you_think_about_circular_economy/
239-1,"These 11 companies are leading the way to a circular economy, reusing what we have in a sustainable way. 
https://www.weforum.org/agenda/2019/02/companies-leading-way-to-circular-economy ",positive,Reddit,https://www.reddit.com/r/recycling/comments/b0g72x/these_11_companies_are_leading_the_way_to_a/
240-1,"A question for the civies here: when a building is demolished, what happens to the construction materials?

I can imagine that anything of value is stripped down before the actual demolishing / imploding / big steel ball hitting the walls: metal pipping, old appliances, electrical cables, etc., and those get melted anew. I can also imagine that this also happens for nice marbles, nice wooden flooring, nice bricks, nice wooden doors, and those get sold at 2nd-hand stores.

Question 1: does this happen for every building size? If I demolish a small family home, will a guy with a van come and do all that work for a bit of salvageable material?

There's also a lot of ""ordinary"" materials in a building, like cement, concrete, insulation (fiber glass or foam panels), glass, structural bricks, etc.",neutral,Reddit,https://www.reddit.com/r/AskEngineers/comments/euj9ik/when_a_building_is_demolished_what_happens_to_the/
240-2,Question 2: what happens in this case? Are the steel rebars somehow ripped out of the concrete slabs and columns? How do you separate the different materials out of the rubble piles? Are ceramic materials used in something like road-building? Or does everything just gets put into a big pile and dumped into a hole in the ground?,neutral,Reddit,https://www.reddit.com/r/AskEngineers/comments/euj9ik/when_a_building_is_demolished_what_happens_to_the/
241-1,"In theory, it costs less to find alternative uses for materials than it does to dump it (depending on dumping fees in your jurisdiction). So more often than not a demolition company will reuse the material them self or sell to or pay someone to take the material.

Some materials, like you say, have salvage value. Copper is a common one that is worth spending the time to strip and sell.

Concrete can be crushed and turned into a fill material, rebar is removed from the final product.",positive,Reddit,https://www.reddit.com/r/AskEngineers/comments/euj9ik/when_a_building_is_demolished_what_happens_to_the/
241-2,"Steel can be either salvaged and reused or sold as scrap. On a bridge project I worked on we salvaged 4 x 16m beams worth thousands brand new, they were painted and in fantastic condition so we kept them for future temporary works instead of scrapping them.

Not sure what you can do with treated timber other than dispose of it, untreated timbers may have re-use purposes though. It has no use as a fill due to organic content.

Old road base and bitumen/asphalt can be re-used as general fill.",positive,Reddit,https://www.reddit.com/r/AskEngineers/comments/euj9ik/when_a_building_is_demolished_what_happens_to_the/
242-1,"I was the HazWaste manager for a local government facility for about 4 years. We tracked all sorts of waste metrics. We were on a 10 year plan to incrementally increase our construction debris diversion rate by 5% per year up to 50% in the last year.

Concrete can be ground up and reused for filler, but the adhesive properties of cement work better on new rocks and it's harder to pass compression tests the more recycled aggregate you use.

We frequently had individuals with good intentions who tried to salvage and reuse materials, but I never saw this successfully implemented. I.e. we had a bunch of structural pavers removed from a retaining wall that we wanted to reuse on another project. They sat in a pile for approximately 5 years before we disposed of them.",negative,Reddit,https://www.reddit.com/r/AskEngineers/comments/euj9ik/when_a_building_is_demolished_what_happens_to_the/
242-2,"One of the complications was the government standards. We had to demonstrate responsible spending of the taxpayer funds. And if we tried to submit a construction bid that included reuse of questionable reclaimed materials it always got rejected.

Additionally, if there's even a bit of asbestos paneling or other suspected contamination, nothing in the debris pile is reused.

Afterthought

We were occasionally successful getting more $$ to dispose of materials at a more expensive waste facility that promised to reuse a certain percentage of the waste we gave them.

In my (limited) experience recycling options always exist, but are USUALLY more expensive. If your leadership prioritized recycling and had money to do so, it could be done.",negative,Reddit,https://www.reddit.com/r/AskEngineers/comments/euj9ik/when_a_building_is_demolished_what_happens_to_the/
243-1,In Germany you pay for the type of waste: the more it is Mixed/polluted the more you pay. So it makes sense to divide the materials as much as possible. Laws in Germany state that every truck leaving a site has to be tested... So eg for normal dirt/soil with stoned I pay 15€/ton. Other materials on it: 75 up to 120,positive,Reddit,https://www.reddit.com/r/AskEngineers/comments/euj9ik/when_a_building_is_demolished_what_happens_to_the/
244-1,Just worked on a concrete crusher and this company destroys buildings then crushes the concrete to be reused as fill and recycles the rebar. Pretty cool to watch.,positive,Reddit,https://www.reddit.com/r/AskEngineers/comments/euj9ik/when_a_building_is_demolished_what_happens_to_the/
245-1,"The future is targeting something closer to this: https://www.arup.com/perspectives/publications/research/section/circular-economy-in-the-built-environment

In the short term, it depends by area.",neutral,Reddit,https://www.reddit.com/r/AskEngineers/comments/euj9ik/when_a_building_is_demolished_what_happens_to_the/
246-1,Crushed concrete is commonly used for road base,neutral,Reddit,https://www.reddit.com/r/AskEngineers/comments/euj9ik/when_a_building_is_demolished_what_happens_to_the/
247-1,"Concrete and brick can be crushed for aggregate. Structural steel and rebar recycled. Clean timber used for woodchip, etc. But that does require sorting, there is the risk of asbestos and the cement content in recycled aggregate causes issues.

It is an area with a lot of potential. Like using recycled glass to make insulation, using more thermoplastic materials for things like flooring and plumbing that are recycleable.",positive,Reddit,https://www.reddit.com/r/AskEngineers/comments/euj9ik/when_a_building_is_demolished_what_happens_to_the/
248-1,"Construction and demolition debris can go in a regular landfill, or there are special landfills just for C&D debris. It is also highly recyclable. Generally copper is worth enough that even in a small home someone will take it and scrap it, but everything else costs more to recycle than to dispose of.",negative,Reddit,https://www.reddit.com/r/AskEngineers/comments/euj9ik/when_a_building_is_demolished_what_happens_to_the/
249-1,"Belgium: You can pay to deliver ""mixed"" but this is extremely expensive. So you sort.

Asbest is removed separately. then you have to remove all glass, plastics. Then all wood.

Finally the big machines arrive and bring the stone/concrete away. Steel bars may be present. This is recycled for ballast, construction etc.",positive,Reddit,https://www.reddit.com/r/AskEngineers/comments/euj9ik/when_a_building_is_demolished_what_happens_to_the/
250-1,"Every part of the cow building gets re-used.

Broken concrete can be ground up and used as fill or even mixed back in to low-standard new pours of concrete.

Steel is easily the easiest to recycle. Wrecking balls and ""Orange Peels"" will crush rebar out of the concrete, then a big magnet grabs everything and puts it in a separate dumpster. That dumpster is sold to a steel mill that pours it into tomorrow's melt.

",positive,Reddit,https://www.reddit.com/r/AskEngineers/comments/euj9ik/when_a_building_is_demolished_what_happens_to_the/
251-1,"Wood and fiberglass can be pulped and turned into pressboard, but the resale value isn't usually as much as it costs to just dump it. The become unconstructed materials",negative,Reddit,https://www.reddit.com/r/AskEngineers/comments/euj9ik/when_a_building_is_demolished_what_happens_to_the/
252,"Circular economy is one of the secret weapons the construction industry can implement to tackle one of its biggest challenges: being one of the world´s largest consumers of raw materials. As the call to stop treating resources as unlimited, circular models are the way to go for the sector.",positive,Blog,https://www.cemexventures.com/circular-economy-in-the-construction-industry/
253,"Currently, only 40% of construction waste is recycled or reused in the entire sector, with most of it not being used in the creation of new buildings. With a market valuation of global waste recycling and circular economy estimated at over $500 billion USD in 2021, the opportunity to embrace circular economy models is up for grabs and will surely benefit all in the construction value chain both in the short and long term.",positive,Blog,
254,"The term circular economy refers to a relatively new production and consumption model that guarantees sustainable growth over time. With a circular economy, companies and individuals alike can optimize the use of resources, reduce consumption of raw materials, and recover waste by recycling or giving it a second life as a new product.",positive,Blog,
255,"As a waste-intensive industry, construction has the potential to greatly impact circular economy business models. Why keep on searching for new materials and resources for new construction projects when most of what you need is already up for grabs from another project? This is the question that drives a circular mentality.",neutral,Blog,
256,"The World Green Building Council shared that a linear economy has been the ruling mindset of the construction industry for a very long time: take, make, waste. Yet, this linear mindset has begun to shift towards a more circular one, where the aim is to replace virgin materials with reused and recycled ones to the furthest extent possible.",neutral,Blog,
257,"Circularity in the construction industry may seem like a challenge, but I believe we are playing in an industry where promoting such practice is almost intrinsic to the nature of our business” expressed Gonzalo Galindo, Head of CEMEX Ventures. “We can reuse our own resources in more than one project and reduce waste significantly while still maintaining the same high standards as when materials are new. It´s a win-win.”",positive,Blog,
258,"he benefits of adopting a circular economy model in construction are evident:

less exploitation of natural resources,
less waste generation,
less landfills dependency,
And the list goes on! Since plenty of the material extraction processes generate unhealthy environmental impacts, the more circular economy, the lower will the carbon dioxide emissions and energy consumption be.",positive,Blog,
259,"Moreso, the pandemic and other global disruptions to the supply chain have taught us to reduce the reliance on other countries when sourcing raw materials. With a circular approach, the construction industry can surpass this hurdle and use more “in-house” resources, allowing for less interruption and halts in the value chain, especially in Europe where many countries depend almost completely on other countries to obtain their resources.",positive,Blog,
260,"Another circular economy benefit is the potential employment increase. According to the European Union, by following this novel approach, 700,000 new jobs will be created by 2030.

Implementing circular economy models into the construction mix can have positive impacts on wellbeing, for example, and has been shown to increase productivity in the industry by up to 10%.",positive,Blog,
261,"As a lead investor in the Contech ecosystem, CEMEX Ventures´ goal is to identify the trends that are driving change in the construction industry and the startups and entrepreneurs who are helping enforce these changes in the sector. When it comes to circular economy, it´s imperative for us that the projects we support take into consideration green construction practices, ergo including a circular economy approach in its very own business models.",positive,Blog,
262,"Last year, be partnered with the startup Soil Connect, a digital marketplace for industry professionals that connects users who need to dispose of soil with those who need it, preventing waste from ending up in landfills and giving new life to demolition and extraction materials. We invested in the startup we saw it offered a clear response to the millions of tons of materials that are generated in excavation projects. This allows us to have a solution in our portfolio that more efficiently, responsibly, and cost-effectively manages waste and materials.",positive,Blog,
263,"The demand for raw materials continues to increase worldwide. Consumption of raw materials is set to nearly double by 20601. The construction industry is one of the largest producers of waste. Thus, a new perspective towards materials is needed. Reusing materials reduces the consumption of raw materials and depicts a first step from a linear to a circular economy. The transition to a circular economy is essential in achieving the objectives of the Paris Agreement. Many governments have therefore set themselves the goal of stimulating a transition to a fully circular economy. While the construction and real estate sector are mainly financially driven, moral and social arguments prevail in the discussion around circularity. Making the morally desirable financially attractive could speed up the transition.",positive,Blog,https://www2.deloitte.com/ce/en/pages/real-estate/articles/creating-a-better-world.html
