comment_id,comment_text,Sentiment,Name of media,link
203-10,for things like brick that's been done for ages that's really common material to reclaim but i think the challenge here is that you kind of put into this chicken and egg situation so for instance if i wanted to get hold of 35 tons of reclaimed steel i would really struggle to find that quantity of material in existence and so i probably would think i would maybe do a look online and i wouldn't find anything and because of that the people at the end of life the demolition contractors and the salvages they don't see any demand for these materials and so they don't think it's worth the additional effort to carefully deconstruct to store and to refurbish the materials because they just don't see people who are wanting it ,negative,Youtube,
203-11,but this shouldn't stop us right from designing for the construction as you said in the beginning we might not have you know all the answers yet but we have to start somewhere if we want to make this transformation possible that's that's absolutely right yeah i've i think with many things in the circular economy you often start to get almost a bit confused around the circularity of responsibilities um you know why should we design for deconstruction when there's there's no market for it at the end but uh it's funny because a while back i was i was making dinner and i got to thinking that that someone must have invented the tin can before the tin opener and i googled it and in fact the tin opener was only brought to market some 50 years after the invention of the tin can so the inventor designed it knowing that it was something transformational but without having all the answers to know how it could be used and and like you said lara you know in terms of circular economy and design for deconstruction we shouldn't wait to have all the answers to start doing ,neutral,Youtube,
203-12,once we start doing what we can do that will start the engine of the circular economy and it will make reuse more viable eventually thank you grace i think that is a great answer to finish this conversation thank you so much for being part of the circular economy show hi this episode of the circular economy show is part of our network workshop an event that takes place twice a year and that's designed for and with the foundations network these workshops provide a forum for social economy insights and inspiration and enable network organizations to connect learn and collaborate with other circular economy professionals around the world it's currently taking place online so if your organization is part of the ellen macarthur foundation's network you can register now at community.emf.org thank you and back to the studio one triton square is an example of better using an already existing building while eliminating waste and pollution and reusing building materials now let's move from the uk to ghana in west africa to take a look at how the building process of some kinder gardens was redesigned let's watch a video narrated by the person involved in the project  ,neutral,Youtube,
203-13,hayley greek who is the social infrastructure lead at arab international development this was a project that we worked with um a local ngo in ghana um called the sabre charitable trust who were focusing um on supporting early childhood education so the design approach that we took um for this project was really um an approach of kind of participatory design um where it was really shaped by the local needs and the local context in terms of the capacity that existed locally to build these schools the materials that existed locally and the understanding of of construction um we really focused on the materials that we were using so because this was a model school and it was to be replicated in um throughout ghana we really wanted to develop a design that could be adaptable to different contexts so using local and material local and renewable materials was key so for example we looked at using soil stabilized blocks instead of local concrete blocks um we looked at how we could improve the production of those soil stabilized blocks and actually um we actually had them tested against some of the concrete blocks that were made locally ,neutral,Youtube,
203-14,and they came out twice as strong we looked at different materials for kind of acoustic insulation for example so using um one example that we used on some of the schools was coconut husks which was a waste product from the coconut farmers that sold coconuts in the communities and looking at kind of cement replacements in the concrete um for for example local cement replacements um the other approach that we looked at in terms of um some kind of sustainable design approach was really designing um the school that um looked at the dimensions of the classroom and the dimensions of the key structural elements um to ensure that there was minimal waste in the materials so i'm really understanding the availability of local materials the length that for example reinforcement bars came in the dimensions of timber components so that we could design a school that had minimal waste so i think the key opportunity um on working on this project was to really kind of support local livelihoods and build capacity of local communities to allow them to not only build kind of a sustainable and safer school within their community ,positive,Youtube,
203-15,but also to use the construction techniques and the materials that were used to then go on and build other um infrastructure within their communities in the surroundings and the local teams um are now fully um to have full ownership on kind of constructing these schools and adapting them to different sites some have made and started their own kind of material um manufacturing in local communities like the seoul blocks or you know making acoustic um insulation out of coconut husks or um or wood shavings um so the impact on i think the local livelihoods and the local community has been in the communities that we've worked with has been huge and that and that continues to kind of happen um each year as they as they roll this school out the way these kindergartens were built used an approach that accommodated local materials and reduced waste in the process through a skill sharing and stakeholder engagement local communities ensure that they use the materials around them and that they implemented the principles of the circular economy in their building process ,neutral,Youtube,
203-16,next up we will hear from eric corey fried who is the senior vice president of sustainability at canon design and also the co-author of the book circular economy for dummies he will not only walk us through what is wrong with the current way we build but he will also talk about how we can look at nature not only as an inspiration but also the way we build buildings can also regenerate nature one thing i've seen in one of your previous conversations is that you all you say that the way we build is wrong uh what does this mean stupid stupid i usually say it's stupid wrong it's even better what does this mean well it's it's stupid i mean think about it we build in the in the dumbest way we make every single building a one-off prototype every single building is a bespoke masterpiece and it's built by hand one stick at a time layer upon layer with tons of joints with you know no opportunities to really reclaim that no understanding or context that that building is going to be remodeled at some point in its lifetime ,negative,Youtube,
203-17,and no real understanding of where the carbon emissions were that went into making it the operational emissions that are going to be caused from running it and and really no connection to the health of the occupants inside of it so it's it's silly and when i was a student you know studying architecture and i would you know raise my hand and say well why do we do it that way if it's so damaging the response was always well i don't know we've always done it that way and that's just that's the worst answer you can get you know if we know it's stupid and yet we've always done it that way well then surely there's something better that we can do and that's that's what it really started to get my attention with the circular economy because i really see it as a framework to use to really start to solve and address a lot of these problems that we're facing in the building industry and i mean you just brought up the circular economy which is obviously one of the topics i i want to cover in this conversation with you um ,negative,Youtube,
203-18,so when we talk about you know we need to transform the built environment industry um what are the sort of the you know the first things that come up to you for you there are so many issues and so many i call them market failures just across the board but let's start with the big one energy and its relationship to carbon buildings are responsible for more than half of the carbon emissions in our environment right if you factor in the uh construction assembly operation and maintenance of buildings it's it's more than half so we're gonna solve this climate crisis we have to change how we do all those things in our buildings not just in the operations but what we make them out of and you know it's really hard to build a building today without concrete and steel and yet concrete steel aluminum and glass those four materials alone are responsible for just the majority of these you know in embodied carbon emissions and and we really don't have viable solutions or alternatives to them yet we're trying but it's it's pretty slow going ,negative,Youtube,
203-19,in a way when we talk about the circular economy we always bring up the three principles so eliminating waste and pollution circulating products and material and materials and regenerating nature um what role you mentioned this briefly about what role does the circular economy play in addressing the emissions from the built environment sector well it depends on how you look at it i really look at it in terms of taking this holistic life cycle approach to it so for everything that we're putting into the building um what were the byproducts of of extracting it um how is it delivered and installed how is it maintained and what are we going to do with it when we're done with it so really just taking that holistic approach one of the things that i do very often with clients is that i'll run them through this thing called the resolve framework which i didn't create it's you know it's um kind of a standard thing but it it just helps me kind of organize the questions of okay well what you know um if if recycling is actually not our top priority but actually our bottom priority ,neutral,Youtube,
203-20,and our first priority is to design out waste that starts to really transform and rethink how we look at a building i'll give you a dumb example let's say you're remodeling your bathroom and let's say you pick out an eight inch tile sorry i'm american i don't do metric but if we do an eight-inch tile um well shouldn't that bathroom also be some module of eight inches so that way the tile space out evenly and you can avoid having a cut you know it always drives me crazy when you're in a bathroom and you see that little extra sliver of tile because someone didn't plan well well we can know that in advance so we can design the bathroom on a modular 8 inches and get nice clean edges that reduces waste it also helps you with other things because everything in the construction is basically on some module of 8 inches right bricks concrete block tiles plywood everything is based on that same module and so if we design to the module we can start to reduce waste in a very easy way and save cost at the same time ,neutral,Youtube,
203-21,many things that we can do low-hanging fruit that a lot of architects and builders haven't even addressed yet to really get us there and one one of the key things in our previous conversation that that you brought that you brought up was nature you started talking to me about nature as kind of like almost like the technology that the built environment should use um so what do you mean by this what can we learn from nature this is this is quite an uh obsession of mine nature is the ultimate innovation factory really right 3.8 billion years of research and development in nature and think about what nature does on a daily basis nature is able to produce energy sequester carbon manufacture oxygen fix nitrogen into the soil provide food provide habitat for thousands of species and it does all this without waste it does all this without massive amounts of heat right it does it in a beautifully balanced equilibrium based loop so there's a lot that we can learn from nature not even getting into dna and biology and all that other stuff just looking at the normal systemic ecosystem services of nature ,neutral,Youtube,
203-22,is just already kind of remarkable i there there are times when i just uh you know walk around in awe constantly at what nature's doing for us for free that we couldn't even possibly start to figure out how to do on our own or even pay for so if we start to look at nature as a technology that starts to change maybe our relationship with it it's not something that we squander it's not something that we destroy it's not something we consume but rather that we work in harmony with so if you would imagine a building that has used nature as as the technology what would it look like and how would it be different from you know like the current buildings that we use well it wouldn't look that different than a tree i mean it might look different but it wouldn't function that differently than a tree meaning it would have roots deep into the ground to use the mass of the earth to create heat it would have solar collectors all over the roof to collect the energy from the sun and convert that into electricity ,neutral,Youtube,
203-23,it would have the ability to sequester carbon in its finishes as opposed to producing carbon as a byproduct it would be healthful and potentially would be able to grow and adapt over time as needed and ideally it would it would be able to provide a habitat for more than just humans but for other species as well that really is what we're after and so that kind of i'm describing a tree not that we should all go live in a house but rather think about nature is that technology that we can use as the model to to do that and we're just scratching the surface with being able to get there and if if we know what um you know what we already need to know from nature or about nature to make this happen why can't we see this happening uh let's say yeah at the scale that we need but also like yeah what do we need what are the sort of challenges or barriers keeping this from happening in reality well that's the depressing part right uh it goes back to the same answer that i got 30 years ago in architecture school ,negative,Youtube,
203-24,which is well i don't know because we've always done it this way right you have a not what is it nine trillion dollar construction industry or something insane that's very embedded and used to a certain way of of building and they know that it's flawed and they know it's not perfect but it's what they know and so getting them to change is difficult in addition we have a code system throughout the world that's really based on three main materials stone um masonry and steel or i'm sorry wood masonry and steel and the code's written for that and that makes total sense but if you wanted to use something alternative to those big three you'd have a fight on your hands you'd have a bit of a challenge you'd have to demonstrate and prove that it meets these requirements we have this now with a product called mass timber it's really engineered wood so it's a renewable resource it's a carbon sink it's engineered to be as strong as steel but we've been slowly fighting with the code to get it to accept that it really has a a great fire resistance rating because ,negative,Youtube,
203-25,it's all engineered it doesn't really burn it's got a great strength and can be used on taller and taller buildings and the code has been slowly evolving uh here in this country to to accept that um so that's some of the barriers right just habit and and code but really i think it's human nature to be wired to be fearful of the new and so i i almost feel like a large part of my job my daily job is getting people used to new radical ideas as i i really see all of our jobs as being filters right to take these complex ideas and filter them down in a way that people can can understand them and relate to them and hopefully get excited about them i feel like for the most part sustainability has come has really come at it from this place of scarcity almost we've almost been apologetic i used to make jokes about this early in my in my talks where i where i i'd say gosh is it okay do you do you mind terribly if we don't put cancer-causing chemicals in the ,negative,Youtube,
203-26,environmentalists kept taking this very apologetic scarcity based approach to this and i i'm kind of over that uh now my my mindset is much more i've got a better building here i've got ideas for better building not only is my building green not only will it save you energy in its operation but my building will also potentially improve test scores in students my my building will potentially improve patient recovery outcomes in healthcare my building will potat will potentially um improve staff retention in an office and staff productivity i have across the board am offering you a better building and if it's a matter of cost then we'll look at the upfront cost but we'll balance the upfront cost with the life cycle cost so that way you actually know what you're paying for you know we've we've driven this kind of developer scarcity mindset into everything that we do and so everybody's so fixated on the upfront cost of the building and if it costs a dollar more they're like no i'm against it but the truth of the matter is that dollar more is pretty well invested ,negative,Youtube,
203-27,because what we've seen is that for the most part sustainability features in the building pay for themselves at least 10 times over the life of the building and so if you're owning the building for any period of time you're going to want to take advantage of those of those benefits especially those outcomes that i talked about in terms of productivity and health and performance and so on so that's it for this episode of the circular economy show we have seen that redesigning the way we design make and use the buildings around us is essential to decarbonize the economy that the circular economy plays a critical role in addressing the emissions from this industry and what some of the examples of these buildings look like from two countries in the world thank you so much for joining us for this episode and subscribe or follow us on this channel you are watching this video on if you would like to get notified every time we go live and if you've missed any episodes or would like to find out more about what we have coming up please check our website thank ,positive,Youtube,
203-28, i'm will hurst managing editor at the architects journal and i'd like to welcome you to this aj 100 club breakfast event our guests this morning from arab architecture are director nick jackson and senior architects christina cox and philip egan who are here to discuss their london office scheme for british land one triton square seen as a model for the reuse of existing buildings and one of the property developers first briem outstanding rated buildings the scheme located in the west end was originally designed by arab for british land in the 1990s in updating it for modern requirements british land initially looked at a new build option but then asked how much of the existing building could be retained or reused setting a clear challenge for arab which acted as engineer as well as architect and contraptor lend lease the resulting project was key in british land being named aj 100 client of the year last september for its pursuit of net zero carbon real estate by 2030 now before i hand over to our speakers i'd just like to extend our thanks to the aj 100 sponsors whose fantastic ongoing support makes these events possible ,neutral,Youtube,
203-29,speakers from arab architecture nick christina and philip they will now present one triton square before we take questions from the audience thank you will um right let me just share so hopefully everybody can see that um so thank you for this opportunity just to explain a little bit about the work we've been doing at triton square building's been on site for two and a half years coming very close to completion now and will emerge just as we come out of lockdown actually which would be very exciting um i think everything i'm going to talk to you about this morning really wouldn't have been possible without the teamwork that has gone on between arab our client long-standing client over many years british land and the contracted lenders who we're working very closely with and the what we've achieved on the project in terms of uh the initiatives around sustainability and particularly carbon i've only been realized really by the collaboration and commitment from all three parties to achieve this um triton square didn't come from nowhere arab and we've been working in this sector for uh over a decade ,neutral,Youtube,
203-30,really in terms of thinking about circular economy we've been going looking at it from a point of view of investment experiment exploration over 10 years we've worked in that sector developing a framework for property in terms of developing a brief that we use internally around the planning the design the use of materials all building around our approach to circular economy and this works across our whole business and is is a strategy that is is growing very rapidly in our our thinking work um our relationship with the yellow macarthur foundation is well established and we have very close partnership there and that works has worked through equally with developing an approach to real estate across a number of trial projects we've developed in conjunction with other partners like ricks and jll in terms of how we embed sort of circular economy thinking in our approach so i just wanted to sort of set that scene really in terms of where the thinking on project of triton square has emerged from that sits alongside our commitment at arab to align our business uh in in all that we do to the uh and our activities ,neutral,Youtube,
203-31,to the un's sustainable development goals the sdgs as a global organization we've adopted those uh 17 initiatives and goals to sort of structure our work at all levels and embed in our strategies around design work and the projects and thinking that we take on at the moment we see ourselves as sort of on a journey we're moving out of a sort of point of sort of green sustainable design and looking increasingly to how the thinking in our work can lead towards restorative and ultimately sort of regenerative design in the way we we approach our work in the built environment so that just sort of sets the context for triton the simple headline really is the work that we've achieved there um has saved approximately 40 000 tons of co2 emissions over the sort of 20-year life of the lease that is made up of embodied and operational carbon and obviously there are many ways you can equate that to sort of understand what that means but in simple terms in what a car does it's a pretty staggering figure um and that work has come from a whole series of initiatives there are some headline,positive,Youtube,
203-32,design changes or design initiatives in the project we've brought to it but there's a lot of other smaller moves um which i will explain as as we go through in some way so the project just to to give those who don't know the building when it was pre-let to denso aegis it was largest west end pre-let in the last 20 years we began with a design and brief that was about achieving briem excellence and that has moved over the course project to achieve briem outstanding which is one of the first buildings uh for british land certainly that has achieved that landmark and one of the few large commercial buildings of this nature that have been able to achieve that as a sort of standalone building that's not not linked into a large energy network it's half a million square feet we've saved forty thousand tons of carbon through the various initiatives we've brought to the scheme uh 54 reduction in the embodied carbon what we did demolish which was very limited um was and and the waste uh was all diverted to other uses so things uh initiatives like plant that was taken off the,positive,Youtube,
