comment_id,comment_text,Sentiment,Name of media,link
178-1,"Firstly, there is little precedent currently for designing buildings from available materials. Normally the building is designed to meet a clients needs and then to be made from readily available materials.",negative,Blog,
178-2,"Secondly, the free issuing of materials to a project is very unusual and this is disruptive to almost all aspects of the supply chain. In this scenario, engineers will be required to adapt loadings to materials presented, rather than finding materials to cope with loadings. Quantity surveyors will be told to use the free issue materials and supplement the rest with new. But with the yield from reuse being less predictable compared to buying all new materials, how do you give a firm project price?",negative,Blog,https://ukgbc.org/news/the-challenges-and-opportunities-of-reusing-steel/
178-3,"Thirdly, as the design is rarely confirmed at the start of a project then material requirements can change dramatically as the detailed design is finalised. On one occasion none of the material that was pre-selected was still required at the time of construction due to design changes. This is a nightmare for Quantity Surveyors and for the carbon calculations.",negative,Blog,
178-4,"Cost is a big factor as many projects take months or years to go from design to construction. If you want to secure materials at concept stage but the construction is 24 months later, the prices secured may bear no reflection on the market prices in force at the time. Moreover, if materials aren’t secured at the outset, they may not be available when they are required. Buying them early does provide price certainty but requires upfront cash and storage. What happens if the design changes? Traditional stockholding looks for quick turnover, the reused market moves much more slowly – it is a different beast.",negative,Blog,
179-1,"     1. Controlling life cycles efficiently
It is no surprise that many products are hard to disassemble or to recycle. Product designers are not waste managers and have no strong reasons to incorporate end-of-life considerations into their products. The circular economy therefore requires integrating the entire product life cycle from raw material extraction to disposal (or preferably reuse and recycling). This can be done either through intensive collaboration between companies or single ownership of the product chain.
However, such integration has many disadvantages. First, if companies own the entire life cycle of products, they can easily cross-subsidize different activities, leading to inefficient production and high prices. Similarly, strong collaboration can facilitate cartel like behaviour. Second, if producers manage the waste of their own products, it may be more difficult to benefit from economies of scale in waste management. Finally, the upfront costs of owning or managing the entire life cycle may be too high for newcomers.
",negative,Blog,https://blogs.ucl.ac.uk/sustainable-resources/2014/03/10/three-challenges-to-the-circular-economy/
179-2,"Making linked industries resilient 

Sometimes the resource loop cannot be closed within one industry. It is possible to turn plastic bottles into plastic bottles into eternity, as closed loop shows, but many industries will see their waste being used as a resource by other industries. Linking up different production chains creates a web of complex interdependencies that can leave the system very vulnerable to disruptions. Similar complexities and collapses are quite common in other systems.

Many proponents of the circular economy set nature as an example. However, nature is not perfect. The huge complexity of ecosystems means that a change in one variable (say loss in biodiversity) can create a cascade of effects ending in the collapse of the entire system. In the same way, a cascade of events led to the crash of the complex and interlinked financial system, which in turn affected many others sectors. The ramifications of a similar crash in for instance manufacturing would be unpleasant at least.",negative,Blog,
179-3,". Keeping the environment on the agenda

The conversation among all the participants at the Resource Events was clearly mostly about the economics of the circular economy. The trillion pound opportunity in transitioning to the circular economy – as calculated by the Ellen MacArthur Foundation – was cited extensively. However, it would be silly to forget that resource use is strongly connected to environmental and social issues.

Of course, there is great potential for reducing environmental harm in applying the circularity concept and many proponents of circularity see this as an important argument in favour of the concept. But the exact relationship between circularity that maximizes profits and circularity that minimizes environmental benefits is unclear. If governments want to support the circular economy, they should know what policies are needed to achieve both economic growth and reduced environmental impacts.",negative,Blog,
180-1,"The circular economy is not a silver bullet for employment, sustainability and prosperity. Companies and governments must carefully measure the anticipated and actual impact of these actions and ensure they take us in the right direction—not into a circular but even less sustainable future. Here are three ways to do just that.",negative,Blog,https://www.wri.org/insights/heres-what-could-go-wrong-circular-economy-and-how-keep-it-track
180-2,Zero waste and 100% circularity have become popular goals—but achieving them can be surprisingly resource-intensive and could lead to actions that compromise overall sustainability.,negative,Blog,
181,Beware of the circular economy Trojan Horse at #INC2 and throughout #PlasticsTreaty negotiations.,negative,Twitter,
176,"Diving into 
@UNEP
's latest report ""Turning off the Tap"". Key takeaway? We can reduce plastic pollution by 80% by 2040 with policy shifts & technology. Economic potential? Massive – $1.27T savings & 700K jobs. Let's create a #CircularEconomy and turn the tide on #PlasticPollution. 🌍 #WorldEnvironmentDay #UNEP
 https://unep.org/resources/turning-off-tap-end-plastic-pollution-create-circular-economy 
@RoseMwebaza
 
@andersen_inger
 
@mremae",positive,Twitter,
177,"Only 7.2% of used materials are cycled back into our economies after use. This has a huge burden on the environment and contributes to the climate, biodiversity, and pollution crises.

The solution? Embracing circular economy.  http://ow.ly/SPtl50Oag2M

Via 
@UNDPClimate",positive,Twitter,
178,"It is time to ditch the ""take-make-waste"" model. A circular economy is key to addressing climate change, biodiversity loss & pollution. Each of us can take action to beat waste pollution.",positive,Twitter,
179,"#Plasticpollution is a ticking time bomb for our climate. Let's start a revolution against single-use plastics, promote responsible consumption, and champion a #circulareconomy that protects our #environment and accelerates the transition to a sustainable future. 🌍🔄",positive,Twitter,
180,"Good people, the achievement of vision 2040 to reduce plastic pollution to 80% requires using existing policy options needed to create a ""circular economy""; reuse, recycling and reorientation of packaging from plastic to alternative materials. 
@SDGActionHub_Ke

@PlaneteerHQ",positive,Twitter,
181,"Reducing waste and promoting recycling and composting are effective ways to minimize our ecological footprint. Let's embrace a circular economy and reduce plastic pollution for a cleaner, healthier Pakistan. #ClimateChangePakistan 
@for_interfaith",positive,Twitter,
182-1,"The most significant challenges identified by
the survey were a lack of incentive to design for end-of-life
issues, followed by the lack of market mechanisms to aid
greater recovery and an unclear financial case",negative,Blog,
182-2,"There was a common thread of the cost benefit for each
party adopting the circular economy not being fully understood
and a general perception that the initial investor may not
benefit. Cost and associated profit was seen to be the dominant
factor in any decision-making process which can be compounded
by the short-termism of many clients. The challenge of
low value of products/materials at the end of life was also significant
for designers (3·43) and manufacturers (3·18), which
can make take-back schemes and reprocessing uneconomical.",negative,Blog,
182-3,"In addition, the benefits of adopting
circular economy may not be shared equally across the supply
chain. This is reflected in the survey findings with the major
challenge of a lack of an incentive to design for end of life.",negative,Blog,
182-4,"The research findings have
shown that this is similar for applying circular economy principles
with the respondents stating that a lack of holistic
approach and the ‘silo’ approach of undertaking design, construction,
facility management and end-of-life activities are the
key challenges.",negative,Blog,
182-5,"One of the largest challenges for adopting circularity in the built
environment is the unclear financial case, which ranked number
one for the majority of stakeholders; having a clear business
case was the most important enabler (3·61).",negative,Blog,
182-6,"A theme evident
from the tabulated responses and the breakout sessions was a
lack of clarity on what the circular economy actually entailed
and the apparent confusion between terms such as reuse and
recycling, suggesting that greater precision is required.",negative,Blog,
182-7,"Having no circular economy-specific legislation in place was
thought to be an important challenge (2·82) and an important
enabler (3·00), although clients, designers and manufacturers
thought it to be less important.",negative,Blog,
182-8,"While legislation and policy did not feature within the most
significant challenges, ambiguous end-of-waste regulations was
ranked as the largest legislation and policy challenge",negative,Blog,
183-1," Govindan and Hasanagic [6]
also demonstrated that technological limitations in the tracking of
recycled materials, quality of recycled products, uncertainty of second
or further cycles, etc. would hinder the selection circular materials",negative,Article,
183-2,"The first challenge is
related to the design of new/refurbished buildings with circular materials
and components (e.g. in terms of design challenge). How previously
used components (e.g. modular elements) can be reused in another new
or refurbished building after suitable and necessary repairing and retrofitting
performed by the manufacturer (based on the take-back system)
(Fig. 5), including such challenges as the business model, quality,
user acceptance, and so on?",negative,Article,
183-3,"Product designers might face
a new challenge of anticipating the social, economic and environmental
challenges during the design process in order to help realize the aims of
circular economy [6].",negative,Article,
183-4,"For
instance, Mahpour [55] highlighted three priority barriers of circular economy in the
design stage namely: (i) agency and ownership issues of end-of-life of
materials; (ii) lack of integration of sustainable waste management and potential reuse; and (iii) associated uncertainty in C&D waste management",negative,Article,
183-5,"Despite the existence of some circular economy frameworks, there is a clear lack of
appropriate business model for circular building. Some studies suggested
that the adoption of a C2C LCA approach in circular building. Yet,
there are several challenges associated with such approach in terms of
business model, such as the life cycle cost, implementation of new
business model, lack of standards on refurbishment products, high costs
of recycled materials, absence of or weak economic incentives for the
industry for further reusing recycled materials, lack of take-back system
from manufacturers, etc. [6,9,87]",negative,Article,
183-6,"Effective implementation of circular economy in the construction industry is still in
its infancy stage [77,80], as comprehensive studies including the system
approach, methodological issues, aspects and indicators, and frameworks
are very limited (Tables 1 and 2), and mostly focuses on construction
waste minimization and recycling into its circular economy frameworks and
evaluation [9].",negative,Article,
183-7,"Nonetheless, Hart et al.
[81] opined that the availability of certain low-priced virgin materials
and technical challenges for material recovery could impose barrier to
the selection and use in the circular economy concept.",negative,Article,
183-8,"Previous studies highlighted that existing resource policies mostly
emphasized on efficient use of resources, instead reducing resources
demand [71]. Alhola et al. [75] demonstrated that public procurement
can promote circular economy and related business models by setting criteria and requirements
so as to help extend product life time and encourage efficient
use of recovered materials. However, specific regulatory frameworks are
still lacking to promote circular economy [18,88].",negative,Article,
183-9,"In addition to economic uncertainty, constant supply and business
risk, and lack of tools and guidelines for the design of circular products
and buildings, the uncertainty related to reusing materials after their
end-of-life is one of the biggest challenges of circular economy implementation [77].",negative,Article,
183-10,"In order to promote circular economy in the construction industry, there must be an
in-depth teamwork and consultation between project teams from the
conceptual stage throughout to the handing over of these projects. These
consultations could be implemented through industrial workshops and
seminars and collaborating businesses and agencies to stimulate demand
for circular economy and promote the circular economy agenda in general [91]. Inadequate
communication with clients, designers and subcontractors; lack of
leadership skills; and low acceptance of idea are also important barriers
[77,92]. ",negative,Article,
184-1,"More specifically, the Construction Products Association (2016, webpage), identified a
range of challenges for the construction industry relating to ‘products, buildings and
infrastructure’, ‘recovery of products/materials’ and ‘business considerations.’ In
addressing products, building and infrastructure, for example, the Construction
Products Association (2016) drew attention to the challenges associated with the long
life and the complexity of buildings, the variable lifespan of many of their component
parts and changes in specifications and technology over time, which may make some
products effectively redundant in the future. In addressing recovery, the Consumer
Products Association (2016) suggested that the often low current commercial value of
materials and products, the lack of secondary market mechanisms and the lack of
effective quality assurance for recycled materials were barriers to the adoption of
greater circularity within the construction industry.",negative,Article,
184-2,"In a survey and follow up workshop of over 100 companies within the construction
industry, Adams et al (2017) identified a number of key challenges for the adoption of
the circular economy across the construction industry. Major challenges included the
complexity of buildings; the fragmented supply chain; lack of a market mechanism for
recovery; lack of circular economy knowledge; lack of incentives to design for end-oflife
products; limited awareness across the supply chain; and lack of interest. The lack
of incentives to design for end-of-life issues for construction products was seen as the
single most important of these challenges and Adams et al. (2017, p. 20) reported that
‘this view was held regardless of the company size or length of experience.’ The
authors also reported that there ‘was a lack of clarity on what the circular economy
actually entailed’ and that ‘the apparent confusion between terms such as reuse and
recycling’ suggested that ‘greater precision is required’ (Adams et al. p. 20). This must
be seen as a concern for the construction industry, but in par at least, it can be seen to
reflect wider views that the ‘circular economy seems to be a collection of vague and
separate issues from several fields’ (Korhonen 2018, p. 37) and that the idea of the
circular economy is ‘more often celebrated than critically interrogated’ (Gregson 2015,
p. 218).",negative,Article,
184-3,"In addition to the industry specific challenges outlined above Ritzen and Sandstrom
(2017) have identified a number of more general attitudinal, financial, structural, and
technological barriers to a transition to a more circular economy. In attitudinal terms, for
example, their findings revealed that risk aversion was a prohibitive factor in making
what were seen as disruptive changes to adopt a circular business model. A shift
towards a circular model was also perceived to require far reaching changes within
companies and to influence all departments and activities. Such changes take both
time and investment and where corporate financial systems are focused on rapid
returns on investment and cost savings this currently does not encourage long term
strategic change. There are also challenges in developing indicators or measures that
might help to monitor how a product or a company is progressing towards the circular
economy. At the same time corporate finance departments are developing and refining
tools to measure the financial costs and benefits of pursuing circular business models.",negative,Article,
184-4,"On the other hand, Gregson et al. (2015, p.235) argued that a circular economy ‘would
require radical transformations to the economic order, including fundamental recasting
of manufacture, retail, consumption and property rights.’ Such radical changes would
extend far beyond the construction sector of the economy. As such, concerns have
been expressed that the concept of the circular economy might be captured by
corporate interests, and more specifically by corporate capitalism.",negative,Article,
184-5,"Based on the interviews conducted, five groups of barriers for the implementation of circular strategies were identified – they were: (1) budget and upfront costs; (2) schedule and project timeline; (3) lack of awareness and change resistance; (4) current construction business model; and (5) lack of regulations and implementation guidelines. ",negative,Article,
185-1,"Budget and schedule constraints are common in construction projects. The implementation of certain circular strategies may require upfront costs in order to enable future reuse of materials and components. Furthermore, lack of in-house expertise and necessity to hire external consultants was cited as a potential additional cost. According to some interviewees, certain owners are more susceptible to invest in sustainability and implementation of circular strategies (e.g., tech companies, or large corporations). However, some owners have tighter budget constraints, which may hinder the adoption of the strategies. While schedule-driven projects may leverage the adoption of some circular strategies such as prefabrication and modularization, schedule constraints might affect the owner’s willingness to implement other strategies such as selective demolition or deconstruction.",negative,Article,
185-2,"Lack of awareness and knowledge of building circularity were cited
as main barriers by nine out of the 17 interviewees. According to
Interviewee D, some of the circular strategies are new to the U.S. construction
context – which is the case of design for disassembly and
design in layers. He mentioned “there have been designers who developed
projects for future deconstruction, it has been done. However,
those were pilot projects, proofs of concept. I don’t think that we have
developed the best pattern yet”. Besides the lack of awareness, resistance
to change is a common characteristic of the construction industry (Lines
et al., 2015). According to Interviewee G, construction projects usually
have high risk and low profit margins involved, which is a scenario that
tends to discourage the adoption of new technologies, and ways of
designing. As pointed out by Acharya et al. (2018), the built environment
is not conducive to a start-up culture. Interviewee M agreed that
resistance to change is a major barrier in the industry – she cited the
following widespread mentality – “This is the way we’ve been doing
construction for years, why change?”",negative,Article,
185-3,"The current construction business model was cited as another major
challenge for the adoption of circular strategies. Interviewee B explained
that the construction developers’ business plan does not necessarily
follow the same lifespan to which the building is designed. That is, often
times, the developer’s investment is recovered way before the intended
building lifespan, in a manner that stakeholders are less concerned with
the end-of-life of the project. On the same subject, Interviewee I pointed
out – “sometimes is difficult for the owners or stakeholders to appreciate
the need for something that is beyond the period of time that they are
thinking about”. Rethinking construction business models is necessary
to incorporate circularity into the built environment. With a few exceptions
(e.g., the lease of carpets and lighting in commercial buildings),
the mainstream construction business model is based on the ownership
of materials and components for a certain period of time before they
reach the end of its useful life and are discarded. Interviewees I and K
discussed the potential to apply product as a service (PaaS) types of
business model to buildings’ facades and steel structures. The application
of this type of model would facilitate the reuse of materials and
components, as well as recycling once the end-of-life is inevitably
reached.",negative,Article,
185-4,"Lastly, seven interviewees cited the lack of regulations and guidelines
as major barriers for the implementation of circular strategies.
Local regulations play an important role especially when it comes to
C&D waste management. ",negative,Article,
186,"In terms of the material flow, the survey identified common barriers described by
Debacker et al. (2016)—the lack of specifications, properties and conditions for reused products,
quality concerns, and limited suppliers. The authors suggest to establish countrywide
urban mining concept and bring the new players into the industry that will be secondary
material producers with appropriate design profile; and innovative business model within
the market context such as “pay-by-use” and “product as the service,” leaving ownership
of the materials to the supplier [41]. It is also fair to note that the secondary materials do
not have a mature market globally in the construction value chain, and implementing the
circular economy principles into the business model is not obvious at the current stage [40,42",negative,Article,
187,"Analysis of urban mines allows the identification of the materials present in the built
stock in a territory and the deposits they form. A deposit comprises resources with similar
characteristics sharing the same units of the constructive system, time, and space [28]. The
material characterization of the stock and flows of buildings and deposits represents one
of the main challenges for applying the CE. It represents the basis for the formulation of
strategies for employment, opportunities, and the technical conditions for reintegrating
resources into the economic loop by preventing them from becoming waste; because the
better a material is known, the more efficient is its outlet.",negative,Article,
188,"The main challenges
identified within the literature in relation to circular economy include; a lack of knowledge of the concept,
unclear financial implications, misaligned regulations and a lack of transparent technical data. ",negative,Article,
189-1,"thank you very much everyone to attend this the first weapon now of this circle economy sections in the 2023. You're right, you are the first to come join us, so let me brief about this circular economy knowledge sharing and capacity building series. It a planned series of the event as you have joined last year to raise the awareness and develop capacity for implementing solution to enable a circular economy solution for the our member countries ",positive,Youtube,
189-2,"so the alternative of the program decided to share the relevant and Tiny knowledge among the ADB staff, and also our client development developing member countries on the approaches, and the solution to enable to Transit from our current economy to a circle economy in our in this region. And also we will decide to build the capacity on the foundation and relevant solution to implement the circular economy in Our member countries. And the last and but not the least to facilitate the dialogue and actions between the among different parties towards how to scale up the investment in the circular economic Solutions ",positive,Youtube,
