comment_id,comment_text,Sentiment,Name of media,link
1-1,"How can a circular economy be implemented in construction industries? 
If you are talking about construction Industries it’s very waste. Construction industry is growing very fastly here I am sharing few important point with you.

While increasing the sustainability of concrete is understandably a top priority for the construction industry, it is not the only one. There has also been much discussion about the many millions of tons of waste produced by the industry worldwide. It's a growing issue that shows no signs of abating. And it has prompted industry leaders to talk more about circular economy solutions.

The best place to begin is at the beginning.

How you approach your construction design from the very start will dictate how well your project will meet circular economy standards.

While compelling, the typical starting point will not suffice.

In today's construction climate, the typical approach is to make a structure as durable as possible using sustainable products.",neutral,Quora,https://www.quora.com/How-can-a-circular-economy-be-implemented-in-construction-industries
1-2,"Of course, this is not an approach that all professionals want to take. However, there are a number of impediments that make change difficult. The American Society of Civil Engineers' 2021 study on the USA region highlights some of them:

Inadequate understanding of circular economy solutions

Inconsistent understanding of what circular economy solutions are Obstacles from existing codes and regulations

Concerns about the durability and resilience of reclaimed materials

Concerns about time and money

Inability to change a project's approach due to a lack of leverage

Building components are not standardized or transportable.

Comparison of the circular economy to other sustainable strategies is difficult.

Consider using a ""Design for Disassembly"" strategy.",negative,Quora,
1-3,"A ""design for disassembly"" (DfD) approach is one of the best ways to ensure waste reduction does not fall by the wayside of your construction. It is a concept that emphasizes designing and planning a building with deconstruction in mind from the start so that its materials can be reused for future construction.

Choose high-quality, long-lasting materials that can withstand disassembly.
If they aren't going to be reused, make sure they can be recycled.
Inquire about take-back programs and cradle-to-cradle certification with your suppliers.
Use salvaged materials for structural and finishing purposes.
Save information on project building materials for future use.
Glues and sealants are preferable to screwed or nailed bolted connections.
Look for simpler-looking fasteners and connection points.
Choose fasteners that can be easily disassembled with standard tools.
Ensure that fasteners are easily accessible.
Choosing the right materials is an important part of that
",positive,Quora,
1-4,"When tackling construction design with DfD, the choice of materials becomes extremely important. That is true regardless of where you are in the construction hierarchy.

Cement producers can help by replacing their use of traditional fossil fuels.

Concrete would be unrecognizable without its primary constituent: cement. However, the production of that material can be quite carbon-intensive. In fact, doing so contributes to approximately 8% of total global carbon emissions.

There are also industrial by-products that can be used to improve concrete mixes.

While emissions from cement production can be reduced, they cannot be eliminated entirely. Another way to reduce carbon emissions and waste is to partially replace cement with other materials.
",neutral,Quora,
1-5,"Increased concrete strength with age
decreased permeability
enhanced concrete durability
Sulfate resistance is improved.
Hydration produces less heat.
Additional LEED points
There is also an additive that may be useful.
Remember that concrete can be recycled.
Because concrete is the world's second-most-used material, it's important to remember that it, too, can be repurposed. Structures made of it will eventually need to be demolished because, like any material, it has a finite life span.

Just make sure it's waterproofed properly.

Of course, quality control is required when producing recycled concrete aggregate. Concrete cannot be recycled in its entirety. Only uncontaminated concrete will do.",positive,Quora,
2-1,"Is the circular economy an intelligent bet for the future?
It is the only way to achieve our future prosperity. It is the best option we have to conquer a desirable future, since there is no other way out, unless we duplicate the surface of the planet Earth. A circular economy is an alternative economy to the traditional linear economy that we know today and that consists of producing, using and disposing of the goods or products that we manufacture, so that the life cycle is short, and that we later turn into waste or garbage. which we have to get rid of.
",positive,Quora,https://www.quora.com/Is-the-circular-economy-an-intelligent-bet-for-the-future
2-2,"On the contrary, the Circular Economy is an economy that maintains the utility of resources for as long as possible, extracts the maximum value from resources while they are in use, as well as recovering and regenerating the products and materials that are used, in the end of its life cycle.

The Circular Economy is absolutely necessary because the world in which we live has finite resources. Metals, gas and oil are not unlimited resources, unlike our appetite for them. In addition, our current development model involves a total linearity throughout the process that starts from the extraction of raw materials, passes through the manufacture of consumer goods, the use of the products it produces and concludes with the generation of waste for its subsequent disposal as garbage. This economy is by definition unsustainable.
",positive,Quora,
2-3,"On the contrary, a circular economy is an alternative model that is anticipated and designed so that the products we manufacture, or the materials we consume, can be reused, recycled or reduced. It creates a kind of biological and ""nutrients"" that allow us to continuously reuse the goods or products of the same quality, drastically reducing our dependence on obtaining new materials.",positive,Quora,
2-4,"In addition, we must consider that the circular economy is a practical solution to the crisis of emerging resources of the planet. The reserves of key resources such as metals and minerals known as rare earths are decreasing, while the costs of exploration and extraction of these mineral resources are increasing. As the current model of the linear economy, consisting of ""produce, use and dispose"" , the final result is a massive production of waste or waste that only causes problems of elimination, as well as a progressive exhaustion of resources.",positive,Quora,
2-5,"In effect, 90% of the raw materials used in the manufacture of a product become garbage, even before the product leaves the factory. In the same way, 80% of manufactured products become garbage within the first six months of its useful life. These facts, together with the growing tensions that arise around geopolitics and supply risks, are contributing to the fact that the prices of these products are often volatile. The Circular Economy could help to stabilize some of these issues and, in particular, to dissociate economic growth from the consumption of resources.",positive,Quora,
2-6,"The Circular Economy is much more than a product recycling

While the substitution of secondary materials for primary materials can offer a partial solution to the problem of depletion of resources, recycling offers limited appeal because its processes are energy intensive and, in general, degrade materials, so that This leads to the continuous high demand for virgin materials. That's what happens with paper or recycling paper.

The circular economy goes beyond recycling, since it is based on an industrial system of restoration oriented towards the design of waste. For this reason, the Circular Economy demands a greater energy contribution in the processes of ""repair, reuse and re-manufacturing"". The objective of the design of the products is not only that the design allows a better recovery, at the end of the life of the product, but that it reduces, to a minimum, the consumption of energy necessary for its recovery.
",positive,Quora,
3-1,"Sustainability: What does 'circular economy' mean?
Essentially it's the more sustainable alternative to our current ""linear"" economy system.

What most industries do right now is: Take, Make and Dispose. Extract resources, process them into products, dispose off after use as waste. This is a linear system, the waste after use ultimately goes back to the earth and is, more often than not, toxic, unusable or takes long to biodegrade.

In the long run, this is definitely not a sustainable approach, unless we start creating new things from the waste that is produced.
",positive,Quora,https://www.quora.com/Sustainability-What-does-circular-economy-mean?no_redirect=1
3-2,"In a circular economy model, we learn from the Earth's natural systems. Whatever nature produces, goes back to nature and this cycle indefinitely repeats (a very simple example would be, a plant grows from the soil, lives and uses water/resources, dies and decomposes back into soil providing nutrients for other plants). Somebody's waste is someone else's food. Similarly, circular economy takes inspiration from natural processes so as to design methods, products or business models that are similar to this regenerative process.",positive,Quora,
3-3,"
How is this done -- by making sure the ""technological"" and ""biological"" factors of the entire process are a part of a bigger material cycle designed for reusability or repurposing. Alter your product or business model accordingly to provide for maintenance or end-of-product-life services; use materials that can last longer or be used again with minimal energy; use renewable energy sources at each step of the process; understand how one part of the process will affect other parts (systems thinking); . A simple image to that can help explain this cycle:




So the circular model (though not very easy to achieve) is ultimately less wasteful, uses resources more efficiently and more industries should adopt the process for long-term overall sustainable development.
",positive,Quora,
4-1,"as a Chinese person, I will give you two circular economy models in China, one has been used for hundreds of years, and the other has emerged in the 21st century.

Mulberry Fish Pond

The Mulberry Fish Pond fishpond deepens the water net depression into a pond, and the dredged mud is piled up on the four sides of the pond to form a high base. Mulberries are planted on the base, fish are raised in the pond, mulberry leaves are used to raise silkworms, and silkworm excrement is used to feed fish, while the sludge in the fishpond can be used to fertilize the mulberry. Through such recycling, the two final products of silk and fresh fish are obtained, realizing the economic benefits of ""both benefits, ten times the profits of ordinary crops"". The production cycle of mulberry, silkworm and fish begins with mulberry planting and ends with sericulture, forming a close relationship between mulberry, silkworm and fish. The quality of any production link in the system will also affect other production links.
",positive,Quora,https://www.quora.com/What-is-the-circular-economy-model
4-2,"There is a Chinese agricultural proverb that describes this matter as follows: mulberry trees grow well - silkworm can grow strong - fish can grow well - the sludge in the pond has good fertility - mulberry trees grow well, in addition to getting stronger pond dams, more cocoons and more fish. （“桑茂、蚕壮、鱼肥大，塘肥、基好、蚕茧多”）Mulberries can also provide vitamins as fruit.

This method has been used in China for more than 2500 years. Huzhou Sangji Fish Pond System has nearly 60000 mu of mulberry land and 150000 mu of fish pond, which is the most concentrated, largest and most complete area in China's Sangji Fish Pond, and is rated by UNESCO as ""rare beauty in the world, a model of virtuous cycle"".
",positive,Quora,
4-3,"

But this may not make sense for most countries except China, because the fish here are freshwater fish, and there are many fish bones in the fish body. Except for Chinese people, there are not many countries like to eat freshwater fish. This is why there are a large number of inland rivers invaded by Asian carp in the United States, but there are few ways to deal with them.

There is also a variety: mulberry - paddy field - fish pond. This model uses paddy fields planted with rice as shallow fish ponds to raise fish. The fish live by eating the fallen leaves, fallen flowers of rice and silkworm excrement. Fish can also eat some pests and pest eggs in paddy fields. In this mode, rice is the main product, and fish and cocoons are by-products. This kind of fish is very delicious.
",neutral,Quora,
4-4,"
In the 21st century, with the rapid development of green energy in China, a new model of circular economy has emerged, that is, solar power plant - sheep husbandry.

Solar power plants use a large amount of semi-desert land in northern China. Because the solar panels shield the sun and reduce the evaporation rate of the ground, the grass in the power station grows better. The grass even grows to the extent that it needs to be weeded, otherwise it will threaten the solar panels, so the solar power plants allow herders to herd sheep in the solar power plants. In this way, sheep have grass to eat, sheep dung improves the fertility of the land, the growth of grass is better, the desertification momentum is stopped, and the solar power station has also completed the weeding work.
",positive,Quora,
5-1,"A new model based on a circular system with no waste leakage needs to take into account the entire value chain. Materials must be chosen that can always be reused or recycled. Design and manufacturing must allow for a standardised and efficient collection and recycling process. The product must meet the consumer's needs, otherwise the consumer will choose another product. Disposal and collection in order to capture the product at the end of its life must be convenient for the consumer. Processing the product back into a reusable resource must be cost effective.

At the core of this change, we need to view product and packaging waste as a commodity. Mainstream penetration of a circular economy model will require a new design approach, industry wide collaboration and a consumer mindset change. Momentum could be gained by initially implementing this model with a few companies that align with sustainable values, have the willpower to change and have a consumer base that believes in these values.
",neutral,Quora,https://www.quora.com/What-are-your-thoughts-on-designing-for-a-circular-economy
5-2,"
The advancement in technologies like 3D printing will also help bring this new design thinking forwards. For example, a toy company can design their toys out of a recyclable plastic (i.e. ABS, PET, HDPE) that can be 3D printed using a home FDM printer. At the end of the toys life, it could be crushed down and processed back into a printable filament (a company called ReDeTec has developed a product called the ProtoCycler for this purpose). The toy company can then sell a new design file for their latest toy that can be printed using that recycled plastic from the old toy.",positive,Quora,
6-1,"
In accordance with the aforementioned lines, the European Commission, through its policies, will promote:

1.- A better design of the products:

Many valuable materials are lost every year, as it is difficult to recover them as products, such as mobile phones or flat screens. Consequently, it is obvious that a better design of the products could help to save resources that are considered valuable. The Commission will support the product requirements under the Eco-Design Directive, which aims to make the products more durable and easier to repair and recycle. As a first step, the Commission will propose rules that make it easier and safer to dismantle or dismantle, reuse and recycle electronic screens. This standard is added to the energy efficiency requirements that exist for products that, in the year 2020, will provide an annual saving of 465 euros / housing on energy bills.
",positive,Quora,https://www.quora.com/What-means-the-production-phase-of-the-circular-economy?no_redirect=1
6-2,"2.- The creation of incentives:

A direct economic incentive is necessary for producers to manufacture products that can be easily recycled or reused. The Commission will propose, in order to differentiate the financial contributions paid by the producers, as extended liability, based on the costs represented by the end of the life cycle of their products.
",positive,Quora,
6-3,"3.- The improvement of the production processes:

In order to reduce the consumption of resources and the generation of waste in the production processes, the Commission will promote best practices in a number of industrial sectors, using the best available reference documents (BREF) that have been developed for the use of different industrial sectors. It will also disseminate guidelines on how to use or reduce mining waste.
",positive,Quora,
6-4,"
4.- The implementation of innovative industrial processes:

The Commission will establish those rules that establish the status that by-products should have and the final state of the waste. All of this will help to support the development of industrial symbiosis - a process by which waste from a company can become the resource from another company. At the same time, it will promote innovative industrial processes, such as industrial symbiosis or efficient re-manufacturing of resources and, in turn, the Commission will support innovative industrial initiatives that will finance the Horizon 2020 program and the Cohesion Policy funds.
",positive,Quora,
6-5,"These policies will directly benefit the companies, since many of the new business opportunities that will emerge under these sustainable development policies will be developed, as is the case of a better product design that involves the use of new technologies and technologies. production materials. In this way, small and medium-sized companies will be able to find opportunities to differentiate themselves from the competition by using more efficient production processes in the use of resources, which will also lead to significant financial savings.

They will also directly benefit consumers by introducing standards that improve waste management and the generation of value from waste. All this will reduce the cost of product management, at the end of its life cycle and will promote a better product design that, in turn, will allow the products to be more durable and efficient.

Finally, these policies will directly benefit the environment by introducing a more intelligent use of resources; This will also help protect the environment and remedy the negative effects of climate change for current and future generations.
",positive,Quora,
7-1,"Hi, I would be very interested in reading something along the lines:

Is it Circular Economy bullshit? For a definition of Bullshit see: On Bullshit - Wikipedia

I don’t know yet, but from what I start to gather…. it smells a lot like bullshit (this coming from someone who started studying Alternative Energy when it was mostly “alternative”, i.e. seen as hippie’s pipe dream, not the backbone of industrial change in the XXIth century). For sure, making laws against planned obsolence and internalize the cost of recycling is the way to go, but I am highly suspicious of the “Circular Economy”, “Organic Agriculture” and of course “Economic of the Common Good”, the better those concepts sounds, the more suspicious you should be.

So, an interesting approach will be: are the assumptions of Circular Economy actually correct? In my opinion, there’s a lot of work to prove they are.
",negative,Quora,https://www.quora.com/Hi-Im-doing-a-research-on-the-circular-economy-and-Im-struggling-to-know-what-is-the-urgency-of-accelerating-the-transition-to-circular-economy-And-how-far-are-we-currently-in-achieving-a-circular-economy
7-2,"
-Well meant but naive approaches on how markets works. Take for instance Zero km agricultural produce markets.

They assume the impact of moving foods from New Zealand or Brazil to Europe it’s massive. (Transport)
Packaging & Recycling
Emissions of the big supermarkets /deparment stores (Retail)
: transport, packaging and retail is negligible in emissions.


FAO on the common but flawed comparisons of greenhouse gas emissions from livestock and transport - CGIAR

-Intellectual frauds to sell books and certifications, in the same line of thought of Self-help literature. Advocating for “Ethical Certification”, “ecological…etc”. Well, the fact is you cannot feed humanity without fertilizers and GMO crops, that’s why we had the Green Revolution, we tried to save hundreds of millions from periodical starving.
",negative,Quora,
7-3,"Take for instance Palm Oil and soya: it’s very efficient in terms of yields per hectare and causes deforestation Do you want everyone to use olive and sunflower oil instead? Well, that would probably cause other problems and 3rd World countries will not stop using it: Why we should be demanding ‘sustainable palm oil’, not ‘palm oil-free’

Is organic really better for the environment than conventional agriculture?

In a nutshell; the most ecological thing you should do is eat more soya, chicken meat raised in automated farms and farmed fished:


See the impact of “traditional agriculture” in Africa: Amazon versus Africa forest fires: Is the world really ablaze? | DW | 30.08.2019
",neutral,Quora,
8-1,"Circular economy is an ecosystem where components, products, and byproducts do not lose much of their value. It seeks to eliminate waste from the current linear production system, also known as “take-make-waste” - where raw materials are extracted from the ground, and not long after getting thrown in the trash.

A circular, or closed-loop, system, develops products and services in a way that is regenerative, restorative, or reusable. This type of a sustainable economy is incredibly important as more and more people around the world become consumers. Research shows that if every country consumed the number of raw materials that the United States does, we would need eight planets to provide all those resources! That's not possible, so to keep enjoying products and services that we love without harming the environment Circular Economy is the solution.",positive,Quora,https://www.quora.com/What-are-some-great-examples-of-the-circular-economy-in-action?no_redirect=1
8-2,"Many companies have already implemented circular economy to make their product, some of them are listed below

- Timberland: From tires to shoes - Timberland has partnered with Omni United, a tire manufacturer, and distributor to produce footwear using recycled tires.

- Johnson Controls: Recycled batteries - Johnson Controls has managed to design a battery that is 99% recyclable, an incredible feat for a product so chemically complex and hazardous.

- Aquazone : Turning wastewater into fertilizer - This Finish company has developed a method of upcycling wastewater into fertilizer!

- VIGGA: A shared wardrobe - With a monthly subscription to VIGGA, customers get 20 pieces of children’s clothing. Once the clothes don’t fit anymore, they are returned and the customer receives another set one size bigger.

- Raw for the oceans : Up cycling ocean trash into clothing - Pharrell Williams has joined the circular economy with his clothing line RAW for the Oceans, which recovers plastic found on the shoreline into wearable fashion, such as jeans, graphic t-shirts etc.
",positive,Quora,
8-3,"Along with these companies other companies namely Winnow, DyeCoo, Close the loop, Enerkem has also adopted Circular economy.

There are many ways that people can adopt the circular economy like by riding shared vehicles, segregating waste at the source, producing biodegradable items, reusing old materials etc.

To know more about Circular economy and Sustainability visit Earth5R Institute of Social and Environmental Sustainability (EISES).

They offer certificate courses in Global Sustainability and Climate Change.

The program blends online and offline learning (within 3 km of your location) with the ongoing projects. Students receive one-to-one learning and experience which offers great flexibility.

There are two different types of course, one for professional and one for students.
",neutral,Quora,
9-1,"My home country, the USA, is doing way too little to support a circular economy. Recycling, for example, is scant, mainly of plastic bottles and beer cans at grocery stores. Products that could circle back into use in some other form (plastic into fabric) still are largely untapped in the economy. No politicians are pushing for a circular economy, and people have little idea what it is.



In fairness, the USA has a lot of wide open spaces and states with no population density that could reasonably be expected to drive a hundred miles to recycle a battery.",negative,Quora,https://www.quora.com/What-steps-is-your-country-taking-to-push-for-a-circular-economy
